{"xyz": [0, 0, 0, 0, 0, 12, 20, 0, 0, 20, 0, 12], "fixed": [true, false, true, false], "els": [{"i": 0, "j": 1, "E": 4176000, "G": 1612800, "A": 0.1, "Iy": 0.01, "Iz": 0.01, "J": 0.001, "yh": [1, 0, 0], "ri": false, "rj": false, "src": "c1", "kind": "frame", "q": {}}, {"i": 2, "j": 3, "E": 4176000, "G": 1612800, "A": 0.1, "Iy": 0.01, "Iz": 0.01, "J": 0.001, "yh": [1, 0, 0], "ri": false, "rj": false, "src": "c2", "kind": "frame", "q": {}}, {"i": 1, "j": 3, "E": 4176000, "G": 1612800, "A": 0.1, "Iy": 0.01, "Iz": 0.01, "J": 0.001, "yh": [0, 1, 0], "ri": true, "rj": true, "src": "b", "kind": "frame", "q": {"D": [0, 0, -1.0], "L": [0, 0, -0.5]}}], "dia": [{"id": "roof", "x": 10, "y": 0, "z": 12, "nodes": [1, 3]}], "nodeLoads": {"D": [0.0, 0.0, 0.0, 0.0, 0.0, 0.0, 0.0, 0.0, 0.0, 0.0, 0.0, 0.0], "L": [0.0, 0.0, 0.0, 0.0, 0.0, 0.0, 0.0, 0.0, 0.0, 0.0, 0.0, 0.0], "Wx": [0.0, 0.0, 0.0, 0.0, 0.0, 0.0, 0.0, 0.0, 0.0, 0.0, 0.0, 0.0], "Wy": [0.0, 0.0, 0.0, 0.0, 0.0, 0.0, 0.0, 0.0, 0.0, 0.0, 0.0, 0.0], "Ex": [0.0, 0.0, 0.0, 0.0, 0.0, 0.0, 0.0, 0.0, 0.0, 0.0, 0.0, 0.0], "Ey": [0.0, 0.0, 0.0, 0.0, 0.0, 0.0, 0.0, 0.0, 0.0, 0.0, 0.0, 0.0]}, "diaLoads": {"D": [0.0, 0.0, 0.0], "L": [0.0, 0.0, 0.0], "Wx": [10, 0.0, 0.0], "Wy": [0.0, 0.0, 0.0], "Ex": [0.0, 0.0, 0.0], "Ey": [0.0, 8, 0.0]}, "notes": []}